[
  {
    "title": "Assistant Manager Finance",
    "company": "Al-Noor Textile Mills",
    "employer_display": "Al-Noor Textile Mills (Pvt) Ltd — Lahore",
    "location": "Lahore, Pakistan",
    "remote": false,
    "type": "Full Time",
    "sector": "private",
    "category": "Finance & Accounting",
    "level": "Mid",
    "qualification": "MBA Finance / M.Com / ACCA (part-qualified)",
    "experience": "3 years",
    "age_limit": "25-40 years",
    "vacancies": 2,
    "salary": "PKR 120,000 - 150,000 / month",
    "salary_min": 120000,
    "salary_max": 150000,
    "salary_currency": "PKR",
    "salary_period": "month",
    "posted": "2026-10-21",
    "last_date": "2026-11-20",
    "how_to_apply": "Email your CV and last salary slip to hr@alnoor.example with the subject: AM Finance.",
    "apply_url": "https://example.com/alnoor/apply",
    "contact_email": "hr@alnoor.example",
    "description": "Own the monthly closing, sales tax and income tax filings, bank reconciliation and internal audit follow-up. You need at least two years of hands-on ERP experience (SAP or Oracle). You will report to the Finance Manager. The office is in Gulberg III, Lahore, and Saturday is a half day.",
    "tags": [
      "Finance",
      "Accounting",
      "Tax",
      "ERP"
    ]
  },
  {
    "title": "Lab Technician (BPS-09)",
    "company": "District Health Authority Sukkur",
    "employer_display": "District Health Authority — Sukkur",
    "location": "Sukkur, Pakistan",
    "remote": false,
    "type": "Full Time",
    "sector": "government",
    "category": "Health & Medical",
    "level": "Junior",
    "qualification": "F.Sc Pre-Medical or Diploma in Lab Technology",
    "experience": "1 year",
    "age_limit": "18-30 years",
    "vacancies": 4,
    "bps": "BPS-09",
    "salary": "PKR 35,000 / month",
    "posted": "2026-10-20",
    "last_date": "2026-11-15",
    "how_to_apply": "Submit the application form with attested documents at the District Health Authority office, Sukkur, during office hours.",
    "contact_email": "hr@example.com",
    "description": "Run routine lab tests at the basic health unit and the TB clinic, keep the sample register up to date and report results to the medical officer. This is a two-year contract post and can be extended on performance.",
    "tags": [
      "Lab",
      "Health",
      "Government"
    ]
  },
  {
    "title": "Junior Software Engineer (Remote)",
    "company": "Northline Systems",
    "employer_display": "Northline Systems — remote",
    "location": "Remote, Pakistan",
    "remote": true,
    "type": "Full Time",
    "sector": "private",
    "category": "Software Development",
    "level": "Junior",
    "qualification": "BS Computer Science or equivalent portfolio",
    "experience": "0-2 years",
    "age_limit": "",
    "vacancies": 1,
    "salary": "PKR 90,000 - 140,000 / month",
    "posted": "2026-10-22",
    "last_date": "2026-11-30",
    "how_to_apply": "Send your CV and a GitHub link to jobs@northline.example. Shortlisted candidates get a 45-minute interview and a small take-home task.",
    "apply_url": "https://example.com/northline/apply",
    "contact_email": "jobs@northline.example",
    "description": "Build and maintain REST APIs in Python, write tests and help ship weekly releases. You will work with one senior engineer and a product manager. This is a fully remote role open to candidates living in Pakistan, with core hours from 10am to 6pm PKT.",
    "tags": [
      "Python",
      "REST",
      "Remote",
      "Junior"
    ]
  }
]